{
  "schema_version": 1,
  "consent_notice_version": 1,
  "instance_id": "11111111-1111-4111-8111-111111111111",
  "machine_id": "aaaaaaaaaaaaaaaaaaaaaaaaaaaaaaaaaaaaaaaaaaaaaaaaaaaaaaaaaaaaaaaa",
  "consent_started_at": "2026-09-25T12:00:00.000000000Z",
  "generated_at": "2026-09-28T12:00:00.000000000Z",
  "version": "1.2.3",
  "os": "linux",
  "installation": null,
  "daily": null
}
